{"contract_version":"1.0.0","product":"cortex","server_id":"cortex_0123456789abcdef","product_version":"1.0.0","api_version":{"major":1,"minor":0},"route_support":["logs","sessions","fleet"],"auth":{"modes":["static_bearer","oauth2"],"issuer":"https://cortex.example.com","audience":"https://cortex.example.com","token_endpoint_origin":"https://cortex.example.com","principal_cache_scope":"subject+issuer","credential_generation":"1"},"streams":{"transport":"none","resume":"none"}}
